section,title,clickbait
ΕΙΔΗΣΕΙΣ,Ελλάδα Καιρός - Μαρουσάκης: Εν αναμονή νέου βαρομετρικού χαμηλού και βαρυχειμωνιάς την επόμενη εβδομάδα 12.11.2025,1
ΕΙΔΗΣΕΙΣ,Διεθνή Το ελληνικό νησί που ψήφισαν οι Βρετανοί ως τον καλύτερο προορισμό για περπάτημα 10.11.2025,1
ΕΙΔΗΣΕΙΣ,"Πολιτισμός Ντεγκά, Ματίς, Μονέ και άλλοι 43 σπουδαίοι καλλιτέχνες σε μια έκθεση στην Αθήνα 14.11.2025",1
ΕΙΔΗΣΕΙΣ,Διεθνή Πρίγκιπας Ουίλιαμ: Νέο βίντεό του πυροδότησε φήμες για το εσωτερικό του Forest Lodge 14.11.2025,1
ΕΙΔΗΣΕΙΣ,TV & Media Ηλιάνα Παπαγεωργίου: Κατέθεσε αγωγή ύψους 1.000.000 ευρώ κατά της Έλενας Χριστοπούλου 14.11.2025,1
ΕΙΔΗΣΕΙΣ,Ελλάδα Σε κρίσιμη κατάσταση 22χρονος στο Γεννηματάς - Κατάπιε ολόκληρο burger χωρίς να το μασήσει 12.11.2025,1
ΕΙΔΗΣΕΙΣ,"Διεθνή Σεισμός 4,4R στην Τουρκία: Προειδοποίηση σεισμολόγου για 7 Ρίχτερ στη γραμμή Ρόδος - Κρήτη 10.11.2025",1
ΕΙΔΗΣΕΙΣ,Τech & Science «Ποπ κορν αντί για πατατάκια» κι άλλες 4 αλλαγές στην καθημερινότητα για πιο υγιές έντερο 10.11.2025,1
ΕΙΔΗΣΕΙΣ,Οικονομία Συντάξεις: Το λάθος που κοστίζει έως 100 ευρώ τον μήνα 10.11.2025,1
ΕΙΔΗΣΕΙΣ,"Πολιτισμός «Εξωφρενικές οι τιμές»: Dua Lipa, Coldplay κι άλλοι καλλιτέχνες ζητούν πλαφόν στη μεταπώληση εισιτηρίων 13.11.2025",1
ΕΙΔΗΣΕΙΣ,Θέατρο Ένα έργο ακραίας βίας. H Σάρα Κέιν έλεγε πως είναι μια ιστορία αγάπης 13.11.2025,1
ΕΙΔΗΣΕΙΣ,"Εικαστικά Αντωνάκης Χριστοδούλου: «Ευτυχώς, υπάρχουν ομόφυλα ζευγάρια που περπατάνε χέρι-χέρι» 11.11.2025",1
ΕΙΔΗΣΕΙΣ,Βιβλίο Τι βγήκε στα βιβλιοπωλεία; Αυτά τα 60 βιβλία ξεχωρίζουν από τις νέες εκδόσεις 12.11.2025,1
ΕΙΔΗΣΕΙΣ,Εικαστικά Οργανωθείτε - Ο Νοέμβριος είναι γεμάτος εκθέσεις 12.11.2025,1
ΕΙΔΗΣΕΙΣ,Ψυχή & Σώμα Το λίπος που δεν φαίνεται είναι και το πιο επικίνδυνο 10.11.2025,1
ΕΙΔΗΣΕΙΣ,Θέατρο Λένα Παπαληγούρα: «Όταν έχεις δυο παιδιά μαθαίνεις να κάνεις οικονομία δυνάμεων» 9.11.2025,1
ΕΙΔΗΣΕΙΣ,Οπτική Γωνία Η πολιτική σαπουνόπερα του Αλέξη Τσίπρα 11.11.2025,1
ΕΙΔΗΣΕΙΣ,Θέατρο Η Άννα Μαρία Παπαχαραλάμπους πιο ελεύθερη από ποτέ 15.11.2025,1
ΕΙΔΗΣΕΙΣ,"Πολιτισμός Στην εποχή του απόλυτου mainstream, κάποιοι αντιστέκονται ακόμα 10.11.2025",1
ΕΙΔΗΣΕΙΣ,Οθόνες Μόνο Λάνθιμος (τι να λέμε τώρα...) 6.11.2025,1
ΘΕΜΑΤΑ,Good Living LiFO x Xiaomi 15T: Ένας διαγωνισμός που σε φέρνει πιο κοντά σε όσα αγαπάς 7.11.2025,1
ΘΕΜΑΤΑ,Good Living Πώς θα γίνεις ο πρωταγωνιστής των φετινών Χριστουγέννων 13.11.2025,1
ΘΕΜΑΤΑ,Good Living Οδηγός αγοράς ακινήτων στην Ελλάδα: Όσα πρέπει να ξέρεις πριν κάνεις το μεγάλο βήμα 5.11.2025,1
ΘΕΜΑΤΑ,"Στυλ & Ομορφιά Lifo Shopping: Ρούχα, αξεσουάρ και ένα φλις πουλόβερ με πολύχρωμα ψάρια 8.11.2025",1
ΘΕΜΑΤΑ,"Good Living Η ενέργεια της τέχνης, το φως της δημιουργίας 12.11.2025",1
ΘΕΜΑΤΑ,Good Living Η συνταγή της αγάπης θέλει πάντα τα πιο φρέσκα υλικά 10.11.2025,1
ΘΕΜΑΤΑ,Αυτοκίνητο Η άφιξη της Nio στην Ελλάδα αλλάζει τα δεδομένα 12.11.2025,1
ΘΕΜΑΤΑ,Υγεία & Ευεξία Επικίνδυνη «μόδα» στο Tik Tok με εφήβους να καταναλώνουν φάρμακα 10.11.2025,1
ΘΕΜΑΤΑ,Εκπαίδευση Open Day στα Εκπαιδευτήρια Αυγουλέα – Λιναρδάτου: Ένα νέο ταξίδι γνώσης ξεκινά 7.11.2025,1
ΘΕΜΑΤΑ,Well Being Artemisio Mountain Running: Μια εμπειρία τρεξίματος πέρα από τα συνηθισμένα 7.11.2025,1
GOOD LIFO,Μικροπράγματα Η σκληρή αλήθεια για την Τζένη Καρέζη 8.11.2025,1
GOOD LIFO,Ιστορία μιας πόλης Χαλκίδα. Ένα μικρό κέντρο του κόσμου την Εποχή του Σιδήρου 13.11.2025,1
GOOD LIFO,Άκου την επιστήμη Συνηθίσαμε τελικά να ζούμε σαν τουρίστες στην πόλη μας; 12.11.2025,1
GOOD LIFO,Μικροπράγματα Η σκληρή αλήθεια για το πώς δείχνει η ελληνική TV τα ΑμεΑ 15.11.2025,1
GOOD LIFO,Αληθινά εγκλήματα Υπόθεση Άκη Πάνου: Από τον πατρικό έλεγχο στις φονικές σφαίρες 9.11.2025,1
GOOD LIFO,LiFO politics Πόσο αντισυστημικός είναι τελικά ο Ζοχράν Μαμντάνι; 16.11.2025,1
GOOD LIFO,Αληθινά εγκλήματα Ποιος σκότωσε την 27χρονη κομίστρια στο Θησείο; 16.11.2025,1
GOOD LIFO,"LiFO politics Ο Σόρος, ο Μασκ και οι «μεγάλες ιδέες» που προωθούν 9.11.2025",1
GOOD LIFO,Radio Lifo Πώς η τεχνητή νοημοσύνη και η ενσυναίσθηση αλλάζουν τον τρόπο που εργαζόμαστε 10.11.2025,1
GOOD LIFO,Μικροπράγματα Η σκληρή αλήθεια για τον Γιώργο Λιάγκα 2.11.2024,1
PODCASTS,"Lifo Picks Η ιστορία μιας ισπανίδας κόμισσας πού έπεσε στο ντιβάνι στα 18 της χρόνια, και αρνήθηκε να ξανασηκωθεί! 25.1.2020",1
PODCASTS,Nowness Eames House: Ένα από τα διασημότερα κτίρια στον κόσμο 14.11.2025,1
PODCASTS,Lifo Videos Αναστασία Τασούλα: «Είμαι η πρώτη ασθενής με κυστική ίνωση που ξύπνησε από κώμα» 27.4.2023,1
PODCASTS,Lifo Picks «Οι αρχιτέκτονες μπορούν να αλλάξουν τις συνθήκες διαβίωσης των ανθρώπων» 11.11.2025,1
PODCASTS,Οι Άλλοι Ανδρέας Τετέι: «Πονάει πολύ το να σε αποκαλούν “μαϊμού” στο γήπεδο» 18.6.2025,1
PODCASTS,Lifo Picks «Goodfellas»: Η ταινία που έδειξε την αληθινή φρίκη της μαφίας 7.11.2025,1
PODCASTS,Nowness Eίναι ζευγάρι. Μαζί σχεδιάζουν κήπους. Τον καλύτερο τον κράτησαν για τον εαυτό τους 8.10.2025,1
PODCASTS,Nowness Χορεύοντας pole dancing πάνω σε κινούμενα φορτηγά 10.11.2025,1
PODCASTS,Lifo Picks Γιατί δεν βρίσκει κανείς σπίτι στην Ευρώπη; 13.11.2025,1
PODCASTS,"Lifo Videos «Βαρέθηκα το “περίοδο έχεις, μωρή, χαπακώσου να περάσει”» 25.10.2025",1
VIDEOS,Οδηγός Γεύσης Brunch με αστέρια Michelin: Ο Λευτέρης Τσούγκας φέρνει το πιο ιδιαίτερο pop-up brunch των Κυριακών στο Brera 12.11.2025,1
VIDEOS,Οδηγός Βιβλίου Βιβλία με ιστορία: Ξεκινά το 4ο Bazaar Βιβλίου του ΜΙΕΤ στο Παλαιό Χρηματιστήριο 6.11.2025,1
VIDEOS,"Οδηγός Θεάτρου Θέατρο Επί Κολωνώ: Αλικάκη, Κούρκουλος, Καφετζόπουλος και Ζερόμ Καλούτα στο νέο του πρόγραμμα 6.11.2025",1
VIDEOS,Οδηγός Γεύσης Brera: Φέρνει στο κέντρο τον αέρα της πιο όμορφης γειτονιάς του Μιλάνου 24.10.2025,1
VIDEOS,"Οδηγός Τέχνες & Πολιτισμός ""Η κορυφή είναι πίσω από το βουνό"" στη Γκαλερί Σκουφά 7.11.2025",1
VIDEOS,Οδηγός Σινεμά Έμα Στόουν και Τζέσι Πλέμονς σε ψυχολογικό μπρα ντε φέρ υπό την επίβλεψη του Γιώργου Λάνθιμου 7.11.2025,1
VIDEOS,I Was There Η Lady Gaga σ' ένα απ' τα πιο συγκλονιστικά σόου της καριέρας της 10.11.2025,1
VIDEOS,"Οδηγός Τέχνες & Πολιτισμός Changing Grounds, Συμπληρωματικές αφηγήσεις στο Αρχείο της Εθνικής Πινακοθήκης 12.11.2025",1
VIDEOS,"Οδηγός Θεάτρου 15 χρόνια Kart Productions, 15 χρόνια ζωντανής δημιουργίας 5.11.2025",1
VIDEOS,Οδηγός Θεάτρου Οι θεατρικές παραγωγές ΤΑΓΑΡΗΣ παρουσιάζουν 15 παραστάσεις 29.10.2025,1
ΕΙΔΗΣΕΙΣ,Διεθνή Κίνα: «Μην παίζετε με τη φωτιά» - Ένταση μετά τη δήλωση της πρωθυπουργού της Ιαπωνίας για την Ταϊβάν 16.11.2025,1
ΕΙΔΗΣΕΙΣ,Ελλάδα Εξάρθρωση κυκλώματος με απάτες: Γνωστή αθλήτρια με συμμετοχή στους Ολυμπιακούς Αγώνες ανάμεσά τους 16.11.2025,1
ΕΙΔΗΣΕΙΣ,"Ελλάδα Καιρός - Κολυδάς: «Προσοχή, έρχονται μεγάλα ύψη βροχής Τρίτη και Τετάρτη» 16.11.2025",1
ΕΙΔΗΣΕΙΣ,Διεθνή Κωνσταντινούπολη: Νεκροί τρεις τουρίστες από δηλητηρίαση - Εκκενώθηκε το ξενοδοχείο που έμεναν 16.11.2025,1
ΕΙΔΗΣΕΙΣ,Πολιτισμός Ένα «μουσείο-ξενοδοχείο» στη Νότια Ιταλία αναβιώνει τη Μεγάλη Ελλάδα 15.11.2025,1
ΕΙΔΗΣΕΙΣ,Ελλάδα Κλειστός ο Εθνικός Κήπος για δύο ημέρες έπειτα από εντολή της ΕΛ.ΑΣ. 15.11.2025,1
ΕΙΔΗΣΕΙΣ,Ελλάδα Επέτειος Πολυτεχνείου 2025: Ποιοι δρόμοι κλείνουν - Πώς θα κινηθούν αύριο τα ΜΜΜ 16.11.2025,1
ΕΙΔΗΣΕΙΣ,"TV & Media Έλενα Χριστοπούλου: «Bλέπω να διασύρεται το όνομά μου, αυτοί οι τίτλοι θα με συνοδεύουν μια ζωή» 16.11.2025",1
ΕΙΔΗΣΕΙΣ,Διεθνή Κέιτ Μίντλετον-Πρίγκιπας Ουίλιαμ: Άλλαξαν ξαφνικά τις φωτογραφίες τους στα social media 15.11.2025,1
ΕΙΔΗΣΕΙΣ,Γεύση Pizza fritta: Η «αμαρτία της λιγούρας» στους Αμπελόκηπους 16.11.2025,1
ΕΙΔΗΣΕΙΣ,Βιβλίο Νέος Κρασναχορκάι και άλλα 9 βιβλία που διαβάζουμε τώρα 16.11.2025,1
ΕΙΔΗΣΕΙΣ,Οι Αθηναίοι Αγγελική Αντωνοπούλου: «Τι να σου πει η τέχνη με μια τέτοια καθημερινότητα» 16.11.2025,1
ΕΙΔΗΣΕΙΣ,"Βιβλίο Ζοζέ Σαραμάγκου: «Πιστεύω πως ό,τι είναι να γίνει δικό μας, θα φτάσει τελικά στα χέρια μας» 16.11.2025",1
ΕΙΔΗΣΕΙΣ,Γειτονιές της Ελλάδας «Δεν μπορώ να φανταστώ τον εαυτό μου να επιστρέφει στην πόλη» 15.11.2025,1
ΕΙΔΗΣΕΙΣ,Design Ένα σπίτι που δίνει χαρά στον πεσιμιστή καλλιτέχνη που κρύβεις μέσα σου 15.11.2025,1
ΘΕΜΑΤΑ,Good Living Τα 4 spirits που έπιναν όλοι στο φετινό Athens Bar Show 15.11.2025,1
ΘΕΜΑΤΑ,Υγεία & Ευεξία Πώς οι οθόνες επηρεάζουν την ανάπτυξη του λόγου στα παιδιά 10.11.2025,1
ΘΕΜΑΤΑ,Εκπαίδευση Netcompany AI Academy: Εκεί όπου ξεκινά η νέα γενιά AI experts 13.11.2025,1
ΘΕΜΑΤΑ,Υγεία & Ευεξία Αντιμετωπίζουμε τη λεύκη με τη βοήθεια του δερματολόγου 10.11.2025,1
ΘΕΜΑΤΑ,Good Living Ταινίες που αξίζει να δείτε στο Vodafone TV αυτή τη στιγμή 16.2.2023,1
GOOD LIFO,Μικροπράγματα Η σκληρή αλήθεια για τους ίντερσεξ ανθρώπους 1.11.2025,1
PODCASTS,"Lifo Videos Madame Ginger: «Ξέρεις, θέλω να σταματήσω να έχω κατάθλιψη» 3.11.2021",1
PODCASTS,"LiFO Talks Βασίλης Μπισμπίκης: «Κανείς δεν είναι άγιος, ούτε εγώ είμαι» 29.10.2025",1
PODCASTS,Nowness Ένα κορίτσι ενηλικιώνεται 12.11.2025,1
PODCASTS,Lifo Talks Μάκης Παπαδημητρίου & Γιώργος Χρυσοστόμου: Τουρτοπόλεμος στην κουζίνα της LIFO 2.10.2017,1
VIDEOS,Οδηγός Μουσικής Μουσικάρες για ένα Σάββατο: Σαν άνοιξη και είναι Νοέμβριος 10.1.2025,1
VIDEOS,Οδηγός Θεάτρου Οι φετινές παραστάσεις της Στέγης του Ιδρύματος Ωνάση 29.10.2025,1
VIDEOS,Οδηγός Θεάτρου «Η Θιβετιανή Βίβλος των Νεκρών» επιστρέφει στο BIOS 14.11.2025,1
ΕΙΔΗΣΕΙΣ,Διεθνή Κέιτ Μίντλετον-Πρίγκιπας Ουίλιαμ: Μετακόμισαν επίσημα στο παντοτινό τους σπίτι 2.11.2025,1
ΕΙΔΗΣΕΙΣ,Διεθνή Ουκρανία: Πώς ο Βέλγος πρωθυπουργός ανέτρεψε το «τρελό» σχέδιο της ΕΕ για δάνειο 140 δισ. ευρώ 24.10.2025,1
ΕΙΔΗΣΕΙΣ,Τech & Science Οι 7 καθημερινές συνήθειες που χαρίζουν ευτυχία και μακροζωία στα γηρατειά 19.10.2025,1
ΕΙΔΗΣΕΙΣ,Πολιτισμός Βανδάλισαν το μνημείο «Ο Χορός του Ζαλόγγου» – Κάρφωσαν σημαίες και εθνόσημα στο έργο του Ζογγολόπουλου 30.10.2025,1
ΕΙΔΗΣΕΙΣ,Διεθνή Οι πιο «επικίνδυνες» χώρες της Ευρώπης τη νύχτα: Πού οι πολίτες φοβούνται περισσότερο 23.10.2025,1
ΕΙΔΗΣΕΙΣ,Ελλάδα Προσωπικός Αριθμός: Έληξε η προθεσμία - Τι ισχύει για όσους δεν έβγαλαν 6.11.2025,1
ΕΙΔΗΣΕΙΣ,Ελλάδα Μαρουσάκης: Νέο κύμα κακοκαιρίας με βροχές και καταιγίδες την 28η Οκτωβρίου 22.10.2025,1
ΕΙΔΗΣΕΙΣ,Ελλάδα Γιώργος Μαζωνάκης: Ο δικηγόρος που αναλαμβάνει τον τραγουδιστή μετά την αποχώρηση του προηγούμενου 20.10.2025,1
ΕΙΔΗΣΕΙΣ,Μουσική Lou: Πόσες ανοιχτά λεσβίες ξέρεις αυτήν τη στιγμή στην ελληνική μουσική σκηνή; 18.10.2025,1
ΕΙΔΗΣΕΙΣ,Μικροπράγματα Η σκληρή αλήθεια για τον Διονύση Σαββόπουλο (updated) 21.10.2025,1
ΕΙΔΗΣΕΙΣ,Οπτική Γωνία «Τι θα ήθελα να είχα μάθει νωρίτερα για τη Γερμανία» 20.10.2025,1
ΕΙΔΗΣΕΙΣ,Design Ένα σπίτι με τον πιο γλυκό και φιλόξενο ιδιοκτήτη 18.10.2025,1
ΕΙΔΗΣΕΙΣ,Μουσική Tάμτα - Ανίτα Ρατσβελισβίλι: «Μάθαμε να ζούμε με το τραύμα» 1.11.2025,1
ΕΙΔΗΣΕΙΣ,Απώλειες Διονύσης Σαββόπουλος (1944-2025): O μέγιστος των Ελλήνων τραγουδοποιών 21.10.2025,1
ΕΙΔΗΣΕΙΣ,Μικροπράγματα Η σκληρή αλήθεια για την Αρλέτα: H πρώτη ζωή 18.10.2025,1
ΕΙΔΗΣΕΙΣ,Οι γαστρονομικές απογνώσεις του Κυρίου Ρεμί «Χίλιες φορές μακαρόνια παρά σπανακόρυζο» 25.10.2025,1
ΕΙΔΗΣΕΙΣ,Μουσική Διονύσης Σαββόπουλος: 25 τραγούδια που έγραψαν ιστορία 24.10.2025,1
ΕΙΔΗΣΕΙΣ,Design Ένα σπίτι με την πιο τέλεια φωλιά για διάβασμα 1.11.2025,1
ΘΕΜΑΤΑ,Στυλ & Ομορφιά Bagblaze: Το ελληνικό brand που δίνει νέα πνοή στο vintage στυλ 4.11.2025,1
ΘΕΜΑΤΑ,Good Living Τα νέα γραφεία της P&G είναι ένα σύγχρονο hub δημιουργικότητας και ευελιξίας 23.10.2025,1
ΘΕΜΑΤΑ,"Good Living HUAWEI WATCH GT 6 Series: Η νέα σειρά smartwatch που σου δίνει ρυθμό, στιλ και ελευθερία 30.10.2025",1
ΘΕΜΑΤΑ,The Good LiFO Η ΔΕΗ «φωτίζει» τις σκηνές του Εθνικού Θεάτρου έως το 2027 24.10.2025,1
ΘΕΜΑΤΑ,Στυλ & Ομορφιά To Birkenstock Boston επιστρέφει πιο σύγχρονο από ποτέ για τη FW25 4.11.2025,1
ΘΕΜΑΤΑ,Good Living Φυτική πρωτεΐνη: Μήπως έχει μεγαλύτερη δύναμη απ' ότι πιστεύεις; 21.10.2025,1
GOOD LIFO,Μικροπράγματα Η σκληρή αλήθεια για την Αρλέτα: Η τελευταία ζωή 25.10.2025,1
GOOD LIFO,"LiFO politics «H κοινωνία δεν λέει ""γύρνα Τσίπρα, γύρνα Σαμαρά""». 30.10.2025",1
GOOD LIFO,LiFO politics Αλέξανδρος Μαλλιάς: «Οι ΗΠΑ είναι κομμένες στα δύο. Αλλάζουν όλα» 25.10.2025,1
GOOD LIFO,Ιστορία μιας πόλης Ασκληπιείο της Κω: Πώς ανακαλύφθηκε το σπουδαίο ιερό του ελληνιστικού κόσμου 6.11.2025,1
PODCASTS,Lifo Videos «Δύο φορές μού γύρισαν την πλάτη όταν ζήτησα να καλύψουν το χειρουργείο μου» 22.10.2025,1
PODCASTS,Lifo Videos «Αυτό που δεν θυμάμαι με τίποτα είναι αν της είπα ότι την αγαπώ» 5.11.2025,1
PODCASTS,Lifo Picks Μέσα στο μεγαλύτερο σπίτι του κόσμου 29.10.2025,1
PODCASTS,Lifo Videos Γκαλ Ρομπίσα: «Στη χώρα μας πρέπει να παλέψεις για να πληρώσεις το νοίκι σου» 21.10.2025,1
PODCASTS,Lifo Picks Γιατί πληρώνουμε χρυσό το φαγητό στο αεροδρόμιο; 3.11.2025,1
PODCASTS,Lifo Videos Ο Αντώνης Αντωνόπουλος διαβάζει την «Τελευταία μαγνητοταινία του Κραπ» 2.11.2025,1
VIDEOS,"Οδηγός Βιβλίου Πες μου τι βιβλίο ψηφίζεις, να σου πω ποιος είσαι 21.10.2025",1
VIDEOS,Οδηγός Μουσικής Μέγαρο Μουσικής Αθηνών: Καμεράτα Ορχήστρα των Φίλων της Μουσικής – Τέσσερις συναυλίες που δεν πρέπει να χάσετε 27.10.2025,1
VIDEOS,"Οδηγός Γεύσης ""Deu-N-Hi-Do"" – Natural Wine Fair Vol. 2: Φημισμένα οινοποιεία από όλη τη Μεσόγειο επιστρέφουν στην Αθήνα 22.10.2025",1
VIDEOS,"Οδηγός Γεύσης Δειπνοσοφιστήριον: Ολιστική εμπειρία που συνδυάζει γεύση, φαντασία και αισθητική 20.10.2025",1
